{
  "agent": "GPT-5.1-Codex",
  "timestamp": "2025-12-03T15:45:00Z",
  "operation": "CREATE",
  "target": {
    "file": "backend/main.py",
    "function": "create_evaluation",
    "lines": {
      "start": 1,
      "end": 416
    }
  },
  "status": "SUCCESS",
  "duration_ms": 0,
  "context": {
    "tasks": [
      "code-analysis",
      "initial-functional-system",
      "suggestions-doc"
    ],
    "token_estimate": "n/a"
  }
}
