{
  "agent": "Antigravity",
  "timestamp": "2025-12-05T12:00:12.486015+00:00",
  "operation": "REFACTOR",
  "target": {
    "file": "tunnel.py"
  },
  "status": "SUCCESS",
  "duration_ms": 0,
  "context": {
    "description": "Refactored tunnel.py to follow Agents.MD protocol",
    "changes": [
      "Added full docstrings with all required elements",
      "Added operation tags ([CREATE], [REFACTOR])",
      "Added complexity analysis for all methods",
      "Added side effects documentation",
      "Fixed syntax errors (elif typo)",
      "Fixed datetime timezone issues",
      "Added proper type hints",
      "Added Agent signature and timestamps"
    ]
  }
}